document,text
doc_54,"The film was a success at the box office.. He is the highest run scorer of all time in International cricket.. Laxman for the fifth wicket to lead India to a score of 282 for 5 from 156 for 4.. Bachchan lent his voice as a narrator to the 2001 movie Lagaan which was a super hit.. One of the most popular sayings by his fans is ""Cricket is my religion and Sachin is my God"".. Bachchan was eventually found not guilty of involvement in the ordeal.. He scored 100 not out off 66 balls.. His role won him his third Filmfare Best Supporting Actor Award.. 37 in the UK and No.. 1 in the US and No.. In 2008 Modi offered land in Gujarat to Tata Motors to set up a plant manufacturing the Nano after a popular agitation had forced the company to move out of West Bengal.. Beliefs Tendulkar is a practising Hindu.. It took him 78 ODIs to score his first century.. By 1963 they were finding their musical stride as well as popularity.. City officials relented and agreed to allow an integrated show.. One of the most popular sayings by his fans is ""Cricket is my religion and Sachin is my God"".. Beliefs Tendulkar is a practising Hindu.. India lost the series and his average of 15.83 was his worst in a Test series with at least three matches.. He returned to the squad in July for Indias tour of England.. Bachchans performance in the film saw him nominated for both the Filmfare Best Actor Award and the Filmfare Award for Best Male Playback Singer.. Tendulkar took three wickets on the final day of the famous Kolkata Test against Australia in 2001.. Thus Sachin Tendulkar became the youngest player to debut for India in Tests at the age of 16 years and 205 days and also the youngest player to debut for India in ODIs at the age of 16 years and 238 days.The series was followed by a tour of New Zealand in which he scored 117 runs at an average of 29.25 in Tests including an innings of 88 in the second Test.. He received positive reviews from critics who hailed his performance as his best ever since Black.. This was later called ""one of the best innings I have seen"" by the then Indian captain Krishnamachari Srikkanth.. He is often praised for his ability to adapt to the needs of his body and yet keep scoring consistently.. He is the youngest recipient to date and the first ever sportsperson to receive the award.. Mick is the one who really has to project himself over the footlights.. He also won Best Batsman and Best Captain awards at 2010 IPL Awards ceremony.. It won him his third National Film Award for Best Actor and fifth Filmfare Best Actor Award.. Tendulkar now considers the 13 coins he won then as some of his most prized possessions.. He said ""Its been a tough phase for me .... He received positive reviews from critics who hailed his performance as his best ever since Black.. Thus Sachin Tendulkar became the youngest player to debut for India in Tests at the age of 16 years and 205 days and also the youngest player to debut for India in ODIs at the age of 16 years and 238 days.The series was followed by a tour of New Zealand in which he scored 117 runs at an average of 29.25 in Tests including an innings of 88 in the second Test.. His performance in Aks won him his first Filmfare Critics Award for Best Actor.. After the elections Vajpayee called the violence in Gujarat a reason for the BJPs electoral defeat and said it had been a mistake to leave Modi in office after the riots.Questions about Modis relationship with Muslims were also raised by many Western nations during his tenure as chief minister.. ""During the Australian tour of India in 1998 Matthew Hayden said ""I have seen God.. He also played an over against Elise Perrys bowling at the latters request.. He also played an over against Elise Perrys bowling at the latters request.. These twin knocks were also known as the Desert Storm innings.. Many former cricketers commented that Dravids declaration was in bad taste."
doc_55,"The destructive pair reduced one bowler to tears and made the rest of the opposition unwilling to continue the game.. Tendulkar scored his 39th ODI hundred on 6 February 2006 in a match against Pakistan.. The ICC revoked the status of the match as a Test as the teams rejected the appointed referee.. Television cameras picked up images that suggested Tendulkar may have been involved in cleaning the seam of the cricket ball.. He dedicated this century to the victims of the Mumbai terror attacks.. These contributions will be of immense help in providing assistance to the persons in distress.. Both the knocks were nominated to be the ODI Batting Performance of the year by ESPNCricinfo.. India went on to win that match.. One of the most popular sayings by his fans is ""Cricket is my religion and Sachin is my God"".. It topped albums charts in at least 28 countries.. The selection committee of BCCI expectedly included Sachin in the national Test squad for the upcoming series against New Zealand commencing in August 2012.. The ICC revoked the status of the match as a Test as the teams rejected the appointed referee.. He started a monthly radio programme titled ""Mann Ki Baat"" on 3 October 2014.. Sachin has scored more than 500 runs in IPL in two different seasons as a captain.Sachin Tendulkar captained Mumbai Indians in 4 league matches of second edition of the league.. Cricinfo columnist Sambit Bal has described him as the ""most wholesome batsman of his time"".. India defeated Sri Lanka in the final.. Several reviewers stated that some of the performances in the film sounded better than their analogous album tracks.. Some of the shows were recorded.. He became the first Prime Minister born after Indias independence from the British Empire.. Many former cricketers commented that Dravids declaration was in bad taste.. It is his second term as he has already held the ambassador of the previous ICC Cricket world cup 2011.. Time magazine named them among the 20th centurys 100 most important people.. This was his first Ranji Trophy match since 2009.. He scored 100 not out off 66 balls.. 2 in the UK and No.. Laxman for the fifth wicket to lead India to a score of 282 for 5 from 156 for 4.. 9 in the UK and the US.. 5 in the UK and No.. He met with some controversy over his attendance at Rajya Sabha proceedings.. He scored 68 in the first match and 48 against Guyana.. It took him 78 ODIs to score his first century.. His role as a doctor with a cynical view of life garnered Bachchan his first Filmfare Best Supporting Actor award.. Live Beatles and Studio Beatles had become entirely different beasts."". He acted as a coach for the Ponting XI during The Big Appeal.. His batting is based on complete balance and poise while limiting unnecessary movements and flourishes.. He said ""Its been a tough phase for me .... This three wicket change the result of test match from draw to win of India.. He became the first Prime Minister born after Indias independence from the British Empire.. The selection committee of BCCI expectedly included Sachin in the national Test squad for the upcoming series against New Zealand commencing in August 2012.. Modis administration has tried to raise foreign direct investment in the Indian economy and reduced spending on healthcare and social welfare programmes."
doc_56,"Three of the five Stones now faced drug charges.. The resulting riots endangered the group and they escaped the country with difficulty.. The show became a massive hit with audiences and broke many TRP Records.. The new ministry also removed or diluted a number of laws related to environmental protection.. He also gave towering performances in Yash Chopras  Trishul and Prakash Mehras Muqaddar Ka Sikandar both of which earned him further Filmfare Best Actor nominations.. The BJPs campaign was assisted by its wide influence in the media.. The Chuck Berry and Muddy Waters records Jagger was carrying revealed a shared interest.. Richards recorded the guitar riff that drives the song with a fuzzbox as a scratch track to guide a horn section.. He dedicated this century to the victims of the Mumbai terror attacks.. 2 in both the UK and US.. 37 in the UK and No.. 1 in the UK and US in May 1966.. 3 in the UK and No.. Emotional Rescue hit the top of the charts on both sides of the Atlantic and the title track reached No.3 in the US.. The band became the first act to see a classic work return to No.. A spell in prison ... will certainly give you room for thought .... 1 in the UK and No.. These sessions included what would become the Rolling Stones first No.. India went on to win that match.. He was affected by a series of injuries since 2004.. It consisted of a pair of lips with a lapping tongue.. Taped copies of the song soon circulated among other radio stations throughout the US.. The bands shows were not advertised to the public.. Hed let us have our own sense of individuality."". International humanitarian aid organisation Medecins Sans Frontieres was among the groups that were put under pressure.. 1 in both the UK and US.. Bruce Springsteen and blues rock band the Black Keys joined the band on the final night.. 2 in the UK and No.. These contributions will be of immense help in providing assistance to the persons in distress.. was released in September 1966 and reached No.. Allen Klein took over his role as the bands manager in 1965.. Business investments Amitabh Bachchan has invested in many upcoming business ventures.. The Stones embarked on their Latin American tour in February 2016.. Critic Lester Bangs declared it the best ever live album.. Modi was forced to go underground in Gujarat and frequently travelled in disguise to avoid arrest.. The album went on to sell over two million copies worldwide.. Bruce Springsteen and blues rock band the Black Keys joined the band on the final night.. 21 on the UK Singles Chart.. General consensus is that Bachchan in his slogan most probably meant Khalistani terrorists and modules active in the country at that point of time and not the Sikh community in general.. Bachchan was eventually found not guilty of involvement in the ordeal."
doc_57,"He was the Chief Minister of Gujarat from 2001 to 2014 and is the Member of Parliament for Varanasi.. The administration plans to construct 60 million toilets by 2019.. The military budget declined over Modis tenure both as a fraction of GDP and when adjusted for inflation.. Modi invited all the other leaders of SAARC countries to his swearing in ceremony as prime minister.. Modi was elected to the legislative assembly soon after.. The Indian media claimed that up to 50 terrorists and Pakistani soldiers had been killed in the strike.. The Supreme Court ordered the land to be handed over to a trust to build the Hindu temple.. The focus on Modi as an individual was unusual for a BJP election campaign.. Modi was ranked fifth on Fortune Magazines first annual list of the ""Worlds Greatest Leaders"" in 2015.. It included shows in small theatres.. All of them were successful at the box office.. He started a monthly radio programme titled ""Mann Ki Baat"" on 3 October 2014.. The Naga insurgency in northeast India had begun in the 1950s.. The Cricket Association of Bengal and the Mumbai Cricket Association organised events to mark his retirement from the sport.. He was hospitalised with reported mild symptoms of the disease on 11 July.. Links between the BJP and the RSS grew stronger under Modi.. Television cameras picked up images that suggested Tendulkar may have been involved in cleaning the seam of the cricket ball.. The new ministry also removed or diluted a number of laws related to environmental protection.. Early life and family Bachchan was born in Allahabad.. In 2013 the state ranked 10th of 21 Indian states in the Human Development Index.. Modi was ranked fifth on Fortune Magazines first annual list of the ""Worlds Greatest Leaders"" in 2015.. Bachchan in an interview with journalist Arnab Goswami offered to fight the case in court and asked the accusers to file the same as also present proof.. The move had the effect of greatly centralising the power previously with the planning commission in the person of the prime minister.. He described the achievement as the biggest in 19 years of his career on the day he achieved the record.. Muddy Waters was quoted as saying that the Rolling Stones and other English bands piqued the interest of American youth in blues musicians.. His first year as prime minister saw significant centralisation of power relative to previous administrations.. Sixty of the 112 tehsils which had depleted the water table in 2004 had regained their normal groundwater levels by 2010.. Bachchan then played the leading role in the film Majboor.. Bachchan in an interview with journalist Arnab Goswami offered to fight the case in court and asked the accusers to file the same as also present proof.. The train carried a large number of Hindu pilgrims returning from Ayodhya after a religious ceremony at the site of the demolished Babri Masjid.. Pallenberg was unable to curb her heroin addiction as Richards struggled to get clean.. Modi travelled around India for two years and visited a number of religious centres before returning to Gujarat.. Modi has relied upon his reputation as a politician able to bring about economic growth and ""development"".. Modis 31 August 2012 post on Google Hangouts made him the first Indian politician to interact with citizens on a live chat.. Awards and recognition Modi was named the Best Chief Minister in a 2007 nationwide survey by India Today.. I couldnt control my tears of joy."". Pakistan initially denied that any strikes had taken place.. That same year he played a double role in the hit Adalat as father and son.. Martins first recording session with the Beatles took place at EMIs Abbey Road Studios in London on 6 June 1962.. In the show he trekked the jungles and talked about nature and wildlife conservation with Grylls."
doc_58,"Captaincy Tendulkars two tenures as captain of the Indian cricket team were not very successful.. Cases of sedition were filed against individuals criticising the government.. He says that Sachins quest for his 100th hundred has proved to be a hurdle for the entire team and has hampered their performance on the Tour of Australia.. I knew that we were in trouble then.. Harrison called Rubber Soul his ""favourite album"" and Starr referred to it as ""the departure record"".. He is the first Indian to win the award.. It came against Bangladesh in the league matches of Asia Cup 2012.. Modis 31 August 2012 post on Google Hangouts made him the first Indian politician to interact with citizens on a live chat.. McCartney has recalled that the album ""wasnt a pleasant one to make"".. Tendulkar would practice for hours on end in the nets.. The releases were commercially successful and the television series was viewed by an estimated 400 million people.. The performances earned him respect from Australian cricket fans and players.. He scored 68 in the first match and 48 against Guyana.. He was affected by a series of injuries since 2004.. He is often praised for his ability to adapt to the needs of his body and yet keep scoring consistently.. Filmography See also The Greatest Indian Achievements of Sachin Tendulkar Collection of quotations related to Sachin Tendulkar Indian national cricket captains List of international cricket centuries by Sachin Tendulkar List of One Day International cricket records Politics and sports Sudhir Kumar Chaudhary  Notes References External links Sachin Tendulkar on Twitter Sachin Tendulkar at ESPNcricinfo Sachin Tendulkar at Wisden India. The film was a success at the box office.. Tendulkar now considers the 13 coins he won then as some of his most prized possessions.. It took him 78 ODIs to score his first century.. Former Australian cricket team coach John Buchanan voiced his opinion that Tendulkar had become susceptible to the short ball early in his innings because of a lack of footwork.. The election was described as a referendum on Narendra Modi.. It took him 78 ODIs to score his first century.. Contribution of George Martin George Martins close involvement in his role as producer made him one of the leading candidates for the informal title of the ""fifth Beatle"".. Denness found Sachin Tendulkar guilty of ball tampering charges and handed him a one Test match ban.. He dedicated this century to his father.. Biographies Books Sachin Tendulkar has been the subject of various books.. Laxman for the fifth wicket to lead India to a score of 282 for 5 from 156 for 4.. The Supreme Court gave the matter to the magistrates court.. Several reviewers stated that some of the performances in the film sounded better than their analogous album tracks.. He also won Best Batsman and Best Captain awards at 2010 IPL Awards ceremony.. He was affected by a series of injuries since 2004.. Tendulkar made his Test debut against Pakistan in Karachi in November 1989 aged 16 years and 205 days.. This was later called ""one of the best innings I have seen"" by the then Indian captain Krishnamachari Srikkanth.. He also played an over against Elise Perrys bowling at the latters request.. 1 in both the UK and US.. Thus Sachin Tendulkar became the youngest player to debut for India in Tests at the age of 16 years and 205 days and also the youngest player to debut for India in ODIs at the age of 16 years and 238 days.The series was followed by a tour of New Zealand in which he scored 117 runs at an average of 29.25 in Tests including an innings of 88 in the second Test.. The album was supplemented by the four tracks already released on their first two singles.. The UK and the European Union refused to admit him because of what they saw as his role in the riots.. Tendulkar now considers the 13 coins he won then as some of his most prized possessions.. One of the most popular sayings by his fans is ""Cricket is my religion and Sachin is my God""."
doc_59,"The Chuck Berry and Muddy Waters records Jagger was carrying revealed a shared interest.. Modi travelled around India for two years and visited a number of religious centres before returning to Gujarat.. Sixty of the 112 tehsils which had depleted the water table in 2004 had regained their normal groundwater levels by 2010.. Guitarists as stylistically disparate as Peter Frampton and Jeff Beck were auditioned as well as Robert A. Johnson and Shuggie Otis.. He was again sworn in as Prime minister on 30 May 2019.. 57 in the UK and No.. 3 in the UK and No.. Haaretz described the concert as being ""Historic with a capital H"".. He described the achievement as the biggest in 19 years of his career on the day he achieved the record.. The song was written and given to the Stones when John Lennon and Paul McCartney visited them in the studio as the two Beatles liked giving the copyrights to songs away to their friends.. International humanitarian aid organisation Medecins Sans Frontieres was among the groups that were put under pressure.. International humanitarian aid organisation Medecins Sans Frontieres was among the groups that were put under pressure.. Bachchans performance in the film saw him nominated for both the Filmfare Best Actor Award and the Filmfare Award for Best Male Playback Singer.. The single ""Streets of Love"" reached the top 15 in the UK.. Indiatimes Movies ranks Deewaar amongst the Top 25 Must See Bollywood Films.. Mostly acoustic numbers from various concerts and rehearsals made up Stripped which reached No.. They objected to playing the Chuck Berry and Bo Diddley songs preferred by Jagger and Richards.. He narrated part of the film Bawarchi.. Television cameras picked up images that suggested Tendulkar may have been involved in cleaning the seam of the cricket ball.. Jones trial took place in November 1967.. The Supreme Court ordered the land to be handed over to a trust to build the Hindu temple.. 1 studio albums in the US.. He dedicated this century to his father.. They objected to playing the Chuck Berry and Bo Diddley songs preferred by Jagger and Richards.. By 1963 they were finding their musical stride as well as popularity.. India lost the series and his average of 15.83 was his worst in a Test series with at least three matches.. A new licence was granted to the Swan label for the single ""She Loves You"".. Bruce Springsteen and blues rock band the Black Keys joined the band on the final night.. Muddy Waters was quoted as saying that the Rolling Stones and other English bands piqued the interest of American youth in blues musicians.. 21 on the UK Singles Chart.. India defeated Sri Lanka in the final.. Some of the shows were recorded.. The most documented of the bands concerts is the Altamont Free Concert at the Altamont Speedway in 1969.. He dedicated this century to the victims of the Mumbai terror attacks.. 37 in the UK and No.. These sessions included what would become the Rolling Stones first No.. That same year he played a double role in the hit Adalat as father and son.. The bands shows were not advertised to the public.. The band parted ways with Oldham during the sessions.. 1 in the UK and No."
doc_60,"He donated this entire salary and allowances to the Prime Ministers Relief Fund.. He was the Chief Minister of Gujarat from 2001 to 2014 and is the Member of Parliament for Varanasi.. Harrison called Rubber Soul his ""favourite album"" and Starr referred to it as ""the departure record"".. Bachchan declined any remuneration for this film.In 2013 he made his Hollywood debut in The Great Gatsby making a special appearance opposite Leonardo DiCaprio and Tobey Maguire.. It is his second term as he has already held the ambassador of the previous ICC Cricket world cup 2011.. He is widely regarded as one of the greatest batsmen in the history of cricket.. The resulting riots endangered the group and they escaped the country with difficulty.. Jones trial took place in November 1967.. Thus Sachin Tendulkar became the youngest player to debut for India in Tests at the age of 16 years and 205 days and also the youngest player to debut for India in ODIs at the age of 16 years and 238 days.The series was followed by a tour of New Zealand in which he scored 117 runs at an average of 29.25 in Tests including an innings of 88 in the second Test.. Bachchans performance in the film received acclaim.. He was awarded by Sports car ""Ferrari"" by Michael Schumacher for achieving this feat.. Haaretz described the concert as being ""Historic with a capital H"".. The Show also grabbed all the major Awards for its category.. All of them were successful at the box office.. His role as a doctor with a cynical view of life garnered Bachchan his first Filmfare Best Supporting Actor award.. Bachchan was crowned as Superstar of the Millennium in 2000 at the Filmfare Awards.. Bachchan lent his voice as a narrator to the 2001 movie Lagaan which was a super hit.. Indiatimes Movies ranks Deewaar amongst the Top 25 Must See Bollywood Films.. Prime Minister Governance and other initiatives Modi was sworn in as the Prime Minister of India on 26 May 2014.. Teji had some influence in Amitabh Bachchans choice of career because she always insisted that he should ""take the centre stage"".The actor who Bachchan credits as having the biggest impact on him was Dilip Kumar.. The company went into administration and was later declared a failed company by the Indian Industries board.. He narrated part of the film Bawarchi.. He narrated part of the film Bawarchi.. His illness made him feel weak both mentally and physically and he decided to quit films and venture into politics.. The train carried a large number of Hindu pilgrims returning from Ayodhya after a religious ceremony at the site of the demolished Babri Masjid.. Early life and family Bachchan was born in Allahabad.. Television cameras picked up images that suggested Tendulkar may have been involved in cleaning the seam of the cricket ball.. State honours Notes References Bibliography External links Official Biographical Sketch in Lok Sabha Website. Bachchans performance in the film received acclaim.. Bachchans performance in the film received acclaim.. It won him his third National Film Award for Best Actor and fifth Filmfare Best Actor Award.. It won him his third National Film Award for Best Actor and fifth Filmfare Best Actor Award.. He was again sworn in as Prime minister on 30 May 2019.. He also entered politics for a time in the 1980s.. The fifth season started on 15 August 2011 and ended on 17 November 2011.. In 1972 he made an appearance in the road action comedy Bombay to Goa directed by S. Ramanathan which was moderately successful.. His role as a doctor with a cynical view of life garnered Bachchan his first Filmfare Best Supporting Actor award.. Bachchan was performing his own stunts in the film and one scene required him to fall onto a table and then on the ground.. He received positive reviews from critics who hailed his performance as his best ever since Black.. His performance in Aks won him his first Filmfare Critics Award for Best Actor."
