document,text
doc_40,"The elaborate cover also attracted considerable interest and study.. Sangh organisations were no longer consulted or informed in advance about Modis administrative decisions.. The train carried a large number of Hindu pilgrims returning from Ayodhya after a religious ceremony at the site of the demolished Babri Masjid.. The BJPs campaign was assisted by its wide influence in the media.. Martin said that the project was ""not at all a happy recording experience.. The new ministry also removed or diluted a number of laws related to environmental protection.. Several reviewers stated that some of the performances in the film sounded better than their analogous album tracks.. It was a time when relations between the Beatles were at their lowest ebb."". Second term During Modis second term the rhetoric of the government shifted from Hindutva to Gujarats economic development.. Cases of sedition were filed against individuals criticising the government.. Tendulkar would practice for hours on end in the nets.. Bachchans performance in the film received acclaim.. The train carried a large number of Hindu pilgrims returning from Ayodhya after a religious ceremony at the site of the demolished Babri Masjid.. Modis 31 August 2012 post on Google Hangouts made him the first Indian politician to interact with citizens on a live chat.. He was again sworn in as Prime minister on 30 May 2019.. Modis 31 August 2012 post on Google Hangouts made him the first Indian politician to interact with citizens on a live chat.. 16 in the UK and No.. That December saw the release of another 59 Beatles recordings on iTunes.. The film was based on the hijacking incident of the Indian Airlines Flight 814.. He recalled the bands insistence ""that everything on Sgt.. Communal tensions were played upon especially in Uttar Pradesh and the states of Northeast India.. His policies during his second term have been credited with reducing corruption in the state.. Modi was ranked fifth on Fortune Magazines first annual list of the ""Worlds Greatest Leaders"" in 2015.. Contribution of George Martin George Martins close involvement in his role as producer made him one of the leading candidates for the informal title of the ""fifth Beatle"".. The film premiered at the 2007 Toronto International Film Festival on 9 September 2007.. The new ministry also removed or diluted a number of laws related to environmental protection.. Jones continues to perform with the band as their touring and session bassist.. The BJPs campaign was assisted by its wide influence in the media.. He was arrested and charged with possession of cannabis.. Sangh organisations were no longer consulted or informed in advance about Modis administrative decisions.. Modi emphasised his governments efforts at sanitation as a means of ensuring good health.. He was also the first sportsperson and the first person without an aviation background to be awarded the honorary rank of group captain by the Indian Air Force.. He is the first Indian to win the award.. The Stones last album of the sixties was Let It Bleed which reached No.. The releases were commercially successful and the television series was viewed by an estimated 400 million people.. In 2013 the state ranked 10th of 21 Indian states in the Human Development Index.. He was again sworn in as Prime minister on 30 May 2019.. General consensus is that Bachchan in his slogan most probably meant Khalistani terrorists and modules active in the country at that point of time and not the Sikh community in general.. He was the first Indian prime minister to do so.. The record carried on the psychedelic vein of Sgt."
doc_41,"The performance won Bachchan his fourth National Film Award for Best Actor and his third Filmfare Critics Award for Best Actor.. Modi was appointed Chief Minister of Gujarat in 2001 due to Keshubhai Patels failing health and poor public image following the earthquake in Bhuj.. That same year he played a double role in the hit Adalat as father and son.. He scored 68 in the first match and 48 against Guyana.. Bachchan lent his voice as a narrator to the 2001 movie Lagaan which was a super hit.. His batting is based on complete balance and poise while limiting unnecessary movements and flourishes.. See also List of awards and nominations received by Amitabh Bachchan List of Bollywood actors List of Indian film actors  Explanatory notes References Further reading External links  Media related to Amitabh Bachchan at Wikimedia Commons  Amitabh Bachchans official blog Amitabh Bachchan on IMDb Amitabh Bachchan at Bollywood Hungama Amitabh Bachchan on Twitter British Academy of Film and Television Arts brochure. Denness found Sachin Tendulkar guilty of ball tampering charges and handed him a one Test match ban.. He took the oath of office on 4 June.. He was declared player of the tournament for his performance during the season.. He dedicated this century to his father.. Tendulkar made his Test debut against Pakistan in Karachi in November 1989 aged 16 years and 205 days.. But Mumbai Indians failed to qualify for semifinals after losing the initial two matches.. He dedicated this century to the victims of the Mumbai terror attacks.. The Beatles were like aliens dropped into the United States of 1964."". Cricinfo columnist Sambit Bal has described him as the ""most wholesome batsman of his time"".. The film premiered at the 2007 Toronto International Film Festival on 9 September 2007.. Its lyric content was the focus of much analysis by the counterculture.. Peppers Lonely Hearts Club Band on the Road opened.. A musical partnership began shortly afterwards.. He says that Sachins quest for his 100th hundred has proved to be a hurdle for the entire team and has hampered their performance on the Tour of Australia.. ""During the Australian tour of India in 1998 Matthew Hayden said ""I have seen God.. He dedicated this century to the victims of the Mumbai terror attacks.. Modis 31 August 2012 post on Google Hangouts made him the first Indian politician to interact with citizens on a live chat.. Both the knocks were nominated to be the ODI Batting Performance of the year by ESPNCricinfo.. Modi invited all the other leaders of SAARC countries to his swearing in ceremony as prime minister.. It became mentally tough for me because nobody talked about my 99 hundreds."". The knock was nominated to be one of the Test Batting Performance of the year by ESPNCricinfo.. The straight drive is often said to be his favourite shot.. Tendulkar has got out 27 times in the 90s during his international career.. The performance won Bachchan his fourth National Film Award for Best Actor and his third Filmfare Critics Award for Best Actor.. Business investments Amitabh Bachchan has invested in many upcoming business ventures.. The film was a success at the box office.. Filmography See also The Greatest Indian Achievements of Sachin Tendulkar Collection of quotations related to Sachin Tendulkar Indian national cricket captains List of international cricket centuries by Sachin Tendulkar List of One Day International cricket records Politics and sports Sudhir Kumar Chaudhary  Notes References External links Sachin Tendulkar on Twitter Sachin Tendulkar at ESPNcricinfo Sachin Tendulkar at Wisden India. Biographies Books Sachin Tendulkar has been the subject of various books.. All of them were successful at the box office.. Teji had some influence in Amitabh Bachchans choice of career because she always insisted that he should ""take the centre stage"".The actor who Bachchan credits as having the biggest impact on him was Dilip Kumar.. And the words were almost irrelevant."". It took him 78 ODIs to score his first century.. The team has been named as Kerala Blasters after his nickname ""Master Blaster""."
doc_42,"The campaign also saw the use of rhetoric based on Hindutva by BJP leaders in certain states.. Taped copies of the song soon circulated among other radio stations throughout the US.. Bachchans performance in the film received acclaim.. The government also announced plans to build new sewage treatment plants.. Modi was appointed Chief Minister of Gujarat in 2001 due to Keshubhai Patels failing health and poor public image following the earthquake in Bhuj.. The new ministry also removed or diluted a number of laws related to environmental protection.. He narrated part of the film Bawarchi.. He became the first Prime Minister born after Indias independence from the British Empire.. A new licence was granted to the Swan label for the single ""She Loves You"".. Prime Minister Governance and other initiatives Modi was sworn in as the Prime Minister of India on 26 May 2014.. Tendulkar now considers the 13 coins he won then as some of his most prized possessions.. Captaincy Tendulkars two tenures as captain of the Indian cricket team were not very successful.. The Supreme Court ordered the land to be handed over to a trust to build the Hindu temple.. His illness made him feel weak both mentally and physically and he decided to quit films and venture into politics.. It also ordered the government to give alternate 5 acre land to Sunni Waqf Board for the purpose of building a mosque.. Communal tensions were played upon especially in Uttar Pradesh and the states of Northeast India.. Modis efforts at centralisation have been linked to an increase in the number of senior administration officials resigning their positions.. Modi was forced to go underground in Gujarat and frequently travelled in disguise to avoid arrest.. Several other companies followed the Tata to Gujarat.The Modi government finished the process of bringing electricity to every village in Gujarat that its predecessor had almost completed.. He received positive reviews from critics who hailed his performance as his best ever since Black.. The Naga insurgency in northeast India had begun in the 1950s.. The record carried on the psychedelic vein of Sgt.. Several deaths were linked to the rush to exchange cash.. Bachchan was eventually found not guilty of involvement in the ordeal.. His first year as prime minister saw significant centralisation of power relative to previous administrations.. The show became a massive hit with audiences and broke many TRP Records.. After the elections Vajpayee called the violence in Gujarat a reason for the BJPs electoral defeat and said it had been a mistake to leave Modi in office after the riots.Questions about Modis relationship with Muslims were also raised by many Western nations during his tenure as chief minister.. Modi refused to remove a government minister from her position after a popular outcry resulted from her referring to religious minorities as ""bastards."". Under the Modi government these restrictions were gradually lifted.. He narrated part of the film Bawarchi.. The focus on Modi as an individual was unusual for a BJP election campaign.. Under the Modi government these restrictions were gradually lifted.. He scored his first ODI century on 9 September 1994 against Australia in Sri Lanka at Colombo.. He was also declared winner of the Time magazine readers poll for Person of the Year in 2014 and 2016.. It performed particularly well in parts of the country that had recently experienced violence between Hindus and Muslims.. Modi travelled around India for two years and visited a number of religious centres before returning to Gujarat.. Modi was appointed Chief Minister of Gujarat in 2001 due to Keshubhai Patels failing health and poor public image following the earthquake in Bhuj.. Awards and recognition Modi was named the Best Chief Minister in a 2007 nationwide survey by India Today.. McCartney described Apple as ""rather like a Western communism"".. His role as a doctor with a cynical view of life garnered Bachchan his first Filmfare Best Supporting Actor award."
doc_43,"On this album Jones contributions expanded beyond guitar and harmonica.. His role won him his third Filmfare Best Supporting Actor Award.. The election was described as a referendum on Narendra Modi.. He started a monthly radio programme titled ""Mann Ki Baat"" on 3 October 2014.. Modi was appointed Chief Minister of Gujarat in 2001 due to Keshubhai Patels failing health and poor public image following the earthquake in Bhuj.. He was the first Indian prime minister to do so.. Modi kept his marriage secret for most of his career.. Cases of sedition were filed against individuals criticising the government.. Bachchans performance in the film received acclaim.. Pakistan initially denied that any strikes had taken place.. Modis efforts at centralisation have been linked to an increase in the number of senior administration officials resigning their positions.. Nobody talked about my 99 hundreds.. It topped albums charts in at least 28 countries.. The train carried a large number of Hindu pilgrims returning from Ayodhya after a religious ceremony at the site of the demolished Babri Masjid.. Modi invited all the other leaders of SAARC countries to his swearing in ceremony as prime minister.. His policies during his second term have been credited with reducing corruption in the state.. The train carried a large number of Hindu pilgrims returning from Ayodhya after a religious ceremony at the site of the demolished Babri Masjid.. Modi refused to remove a government minister from her position after a popular outcry resulted from her referring to religious minorities as ""bastards."". He was the first Indian prime minister to do so.. The campaign also saw the use of rhetoric based on Hindutva by BJP leaders in certain states.. In the show he trekked the jungles and talked about nature and wildlife conservation with Grylls.. Bachchans performance in the film received acclaim.. That same year he played a double role in the hit Adalat as father and son.. He started a monthly radio programme titled ""Mann Ki Baat"" on 3 October 2014.. He was the first Indian prime minister to do so.. Richards called it ""a bridge into thinking about writing for the Stones.. The album was supplemented by the four tracks already released on their first two singles.. He also played an over against Elise Perrys bowling at the latters request.. Other organisations affected included the Sierra Club and Avaaz.. His policies during his second term have been credited with reducing corruption in the state.. International humanitarian aid organisation Medecins Sans Frontieres was among the groups that were put under pressure.. Muddy Waters was quoted as saying that the Rolling Stones and other English bands piqued the interest of American youth in blues musicians.. During this trip the stormy relations between Jones and Pallenberg deteriorated to the point that she left Morocco with Richards.. He said ""Its been a tough phase for me .... It performed particularly well in parts of the country that had recently experienced violence between Hindus and Muslims.. International humanitarian aid organisation Medecins Sans Frontieres was among the groups that were put under pressure.. Richards wanted to tour in the summer or autumn of 1980 to promote the new album.. He was also declared winner of the Time magazine readers poll for Person of the Year in 2014 and 2016.. Modi played a dominant role in the BJPs election campaign.. Richards wanted to tour in the summer or autumn of 1980 to promote the new album."
doc_44,"Bachchan declined any remuneration for this film.In 2013 he made his Hollywood debut in The Great Gatsby making a special appearance opposite Leonardo DiCaprio and Tobey Maguire.. Captaincy Tendulkars two tenures as captain of the Indian cricket team were not very successful.. They have a daughter Sara and a son Arjun whose skills in cricket as a teenager have been receiving attention.. McCartney and Starr remain musically active.. Sachin has scored more than 500 runs in IPL in two different seasons as a captain.Sachin Tendulkar captained Mumbai Indians in 4 league matches of second edition of the league.. India went on to win that match.. Bachchan declined any remuneration for this film.In 2013 he made his Hollywood debut in The Great Gatsby making a special appearance opposite Leonardo DiCaprio and Tobey Maguire.. He scored 68 in the first match and 48 against Guyana.. The Beatles use of psychedelic drugs was at its height during that summer.. McCartney and Sony agreed to a confidential settlement in June 2017.. Since then Tendulkars batting has tended to be less attacking.. The team has been named as Kerala Blasters after his nickname ""Master Blaster"".. Its lyric content was the focus of much analysis by the counterculture.. He followed up the innings with an unbeaten 60 in the second innings of the Test.. He also won the 2010 Sir Garfield Sobers Trophy for cricketer of the year at the ICC awards.. He spend 613 minute at crease.. Modi emphasised his governments efforts at sanitation as a means of ensuring good health.. It took him 78 ODIs to score his first century.. India defeated Sri Lanka in the final.. I couldnt control my tears of joy."". It is his second term as he has already held the ambassador of the previous ICC Cricket world cup 2011.. Tendulkar was given a suspended ban of one game by Denness in light of alleged ball tampering.. The 1975 Tour of the Americas kicked off in New York City with the band performing on a flatbed trailer being pulled down Broadway.. His first year as prime minister saw significant centralisation of power relative to previous administrations.. The company went into administration and was later declared a failed company by the Indian Industries board.. He is the youngest recipient to date and the first ever sportsperson to receive the award.. He also won Best Batsman and Best Captain awards at 2010 IPL Awards ceremony.. Tendulkar and Navjot Singh Sidhu both made centuries to set a then record partnership for the second wicket.. The BJPs campaign was assisted by its wide influence in the media.. He spend 613 minute at crease.. It is his second term as he has already held the ambassador of the previous ICC Cricket world cup 2011.. Thus Sachin Tendulkar became the youngest player to debut for India in Tests at the age of 16 years and 205 days and also the youngest player to debut for India in ODIs at the age of 16 years and 238 days.The series was followed by a tour of New Zealand in which he scored 117 runs at an average of 29.25 in Tests including an innings of 88 in the second Test.. He said ""Its been a tough phase for me .... Tendulkar and Navjot Singh Sidhu both made centuries to set a then record partnership for the second wicket.. Under the Modi government these restrictions were gradually lifted.. He is known for his unique punch style of hitting the ball over square.. He was the highest run scorer of the 1996 Cricket World Cup with a total of 523 runs and also of the 2003 Cricket World Cup with 673 runs.. Denness found Sachin Tendulkar guilty of ball tampering charges and handed him a one Test match ban.. Cricinfo columnist Sambit Bal has described him as the ""most wholesome batsman of his time"".. India went on to win that match."
doc_45,"I dont think it could have been worse if they had heard that their own fathers had dropped dead."". The Beatles broke their own record for the album with the longest gap between topping the charts as Abbey Road hit the top spot 50 years after its original release.. Several reviewers stated that some of the performances in the film sounded better than their analogous album tracks.. The elaborate cover also attracted considerable interest and study.. His role as a doctor with a cynical view of life garnered Bachchan his first Filmfare Best Supporting Actor award.. Live Beatles and Studio Beatles had become entirely different beasts."". The record carried on the psychedelic vein of Sgt.. He followed up the innings with an unbeaten 60 in the second innings of the Test.. The venues were large enough in size that the band became ""like ants"" to audience members.. He started a monthly radio programme titled ""Mann Ki Baat"" on 3 October 2014.. They were integral to the development of 1960s counterculture and popular musics recognition as an art form.. The album was supplemented by the four tracks already released on their first two singles.. The show became a massive hit with audiences and broke many TRP Records.. These included string and brass ensembles as well as Indian instruments such as the sitar in ""Norwegian Wood"" and the swarmandal in ""Strawberry Fields Forever"".. The band parted ways with Oldham during the sessions.. Magical Mystery Tour and Yellow Submarine Two Beatles film projects were conceived within weeks of completing Sgt.. Cutler repeated the introduction throughout their 1969 US tour.. McCartney described Apple as ""rather like a Western communism"".. Peppers Lonely Hearts Club Band on the Road opened.. The knock was nominated to be one of the Test Batting Performance of the year by ESPNCricinfo.. Pepper foremost on its list of the greatest albums of all time.. Their thematic reach was beginning to expand as they embraced deeper aspects of romance and philosophy.. We had microphones right down in the bells of brass instruments and headphones turned into microphones attached to violins.. McCartney and Starr remain musically active.. Epstein accused Datebook of having taken Lennons words out of context.. The Beatles broke their own record for the album with the longest gap between topping the charts as Abbey Road hit the top spot 50 years after its original release.. 6 in the UK and No.. This was later called ""one of the best innings I have seen"" by the then Indian captain Krishnamachari Srikkanth.. Their thematic reach was beginning to expand as they embraced deeper aspects of romance and philosophy.. He received positive reviews from critics who hailed his performance as his best ever since Black.. Time magazine named them among the 20th centurys 100 most important people.. Its lyric content was the focus of much analysis by the counterculture.. We had microphones right down in the bells of brass instruments and headphones turned into microphones attached to violins.. The focus on Modi as an individual was unusual for a BJP election campaign.. 22 lakh from his MPLAD funds allotted to him during his stint as Rajya Sabha MP for the renovation of a Childrens Park in East Bandra.. The Beatles were like aliens dropped into the United States of 1964."". The Beatles were an English rock band formed in Liverpool in 1960.. Martin said that the project was ""not at all a happy recording experience.. That same year he played a double role in the hit Adalat as father and son.. 1 studio albums in the US."
doc_46,"He also declared his growing lack of interest in the Rolling Stones.. Tendulkar made an unbeaten 204 as Shane Warne conceded 111 runs in 16 overs and Australia lost the match within three days.. Richards wanted to tour in the summer or autumn of 1980 to promote the new album.. Some of the shows were recorded.. India went on to win that match.. Stadium shows provided a new challenge for the band.. Jagger met Richards again on 17 October 1961 on platform two of Dartford railway station.. 3 in the UK and No.. 3 in the UK and No.. The Rolling Stones are an English rock band formed in London in 1962.. The cricketer is also known to celebrate Ganesh Chaturthi at home and frequently visits temples during night when it is calm and quiet.. The tongue and lips design was part of a package that VH1 named the ""No.. Development debate A contentious debate surrounds the assessment of Gujarats economic development during Modis tenure as chief minister.. The Beatles were like aliens dropped into the United States of 1964."". At their second show in London Eric Clapton and Florence Welch joined the group onstage.. Guitarists as stylistically disparate as Peter Frampton and Jeff Beck were auditioned as well as Robert A. Johnson and Shuggie Otis.. New music released by the band while under this contract was to be issued through Universals Polydor label.. The resulting riots endangered the group and they escaped the country with difficulty.. The cricketer is also known to celebrate Ganesh Chaturthi at home and frequently visits temples during night when it is calm and quiet.. Sticky Fingers reached number one in both the UK and the US.. The Rolling Stones played a private tribute concert for him at Londons 100 Club in February 1986.. He recommended they go into tax exile before the start of the next financial year.. Bachchan in an interview with journalist Arnab Goswami offered to fight the case in court and asked the accusers to file the same as also present proof.. The election was described as a referendum on Narendra Modi.. The film was a success at the box office.. 57 in the UK and No.. The Netherlands was chosen because it does not directly tax royalty payments.. 1 in the UK and US in May 1966.. The Supreme Court ordered the land to be handed over to a trust to build the Hindu temple.. The Rolling Stones first US tour in June 1964 was ""a disaster"" according to Wyman.. Time magazine named them among the 20th centurys 100 most important people.. The album went on to sell over two million copies worldwide.. He scored his first ODI century on 9 September 1994 against Australia in Sri Lanka at Colombo.. 16 in the UK and No.. Bruce Springsteen and blues rock band the Black Keys joined the band on the final night.. The state government stated later that 790 Muslims and 254 Hindus were killed.. The Hells Angels biker gang provided security.. They objected to playing the Chuck Berry and Bo Diddley songs preferred by Jagger and Richards.. Designer John Pasche created the logo following a suggestion by Jagger to copy the out stuck tongue of the Hindu goddess Kali.. Harrison thus owns the rights to his later Beatles songs such as ""While My Guitar Gently Weeps"" and ""Something""."
